<!ELEMENT Cricket (Team+)>
<!ELEMENT Team (Name,World_Cup,Description,Player,Coach,Ranking)>
<!ELEMENT Name (#PCDATA)>
<!ELEMENT World_Cup (#PCDATA)>
<!ELEMENT Description (#PCDATA)>
<!ELEMENT Player (#PCDATA)>
<!ELEMENT Coach (#PCDATA)>
<!ELEMENT Ranking (#PCDATA)>

